MeetingID|GroupName|Address|Area|State|PostCode|Day_Time|Contact|PartialMatch|FormattedAddress|Exact_Lat|Exact_Lng
"424"|"Turning Point Group."|"No 100 GST Road, Power AG Church,"|"Madhurantakam"|"Tamilnadu"|"603306"|"Thu. 6.30 pm"|"09047955626"|"true"|"18/2, Church Street, G.S.T. Rd, Madurantakam, Tamil Nadu 603306, India"|"12.514088800"|"79.887924100"
"425"|"Spiritual Group."|"CSI Andrews Church, Opp. St . Joseph Higher Secondary School"|"Chengalpattu"|"Tamilnadu"|"603002"|"Fri. 7.00 pm"|"09092349721"|"true"|"Kancheepuram High Road, Chengalpattu, Tamil Nadu 603002, India"|"12.697704900"|"79.974439400"
"426"|"Faith Group."|"Govt Hospital,"|"Uthiramepur"|"Tamilnadu"|"603406"|"Thu. 6.30 pm"|"09444287501"|"true"|"No. 22 Vannara Street, Uthiramerur, Tamil Nadu 603406, India"|"12.615552000"|"79.761093000"
"427"|"Higher Power Group."|"No 55, Ekambaranathar Street, Rajalaxmi Diabetic Centre,"|"Knachipuram"|"Tamilnadu"|"603502"|"Fri. 6.00 pm"|"09566299303"|"true"|"No 55, Ekambaranathar Street, Rajalaxmi Diabetic Centre, ,  Knachipuram, Tamilnadu -  603502"|"12.834174000"|"79.703640000"
"428"|"Good Life Group."|"Sagayamadha Tailoring School, Near Malai Adivaram"|"Thirukkalukundram"|"Tamilnadu"|"603109"|"Sat 7.00 pm"|"09597297212"|"true"|"Sagayamadha Tailoring School, Near Malai Adivaram ,  Thirukkalukundram, Tamilnadu -  603109"|"12.611327000"|"80.056588000"
"429"|"Succes Way Group."|"CSI Church, Railway Road, Opp Govt Hospital"|"Kanchipuram"|"Tamilnadu"|"631502"|"Sat. 6.00 pm"|"09543327306"|"true"|"CSI Church, Railway Road, Opp Govt Hospital ,  Kanchipuram, Tamilnadu -  631502"|"12.834174000"|"79.703640000"
"430"|"Rebirth Group."|"CSI Church, Madha Kovil Street,"|"Kattangulathur"|"Tamilnadu"|"603203"|"Sat. 7.00 pm"|"09092419955"|"true"|"Mudichur Road, Mudichur, Kanchipuram, Tamil Nadu 600048, India"|"12.912830800"|"80.070427400"
"431"|"Reflection Group."|"St. Joseph Church, Old Bus Stop,"|"Chengalpattu"|"Tamilnadu"|"603202"|"Sun. 6.00 pm"|"09380277772"|"true"|"J C K Nagar, Paranur, Tamil Nadu 600073, India"|"12.697922100"|"79.975658200"
"432"|"A.A. Group"|"Govt. H.P. School, Thudhipete Tarikere"|"Chikmangluru"|"Karnataka"|"577228"|"Sun 6.00 pm"|""|"true"|"Govt. H.P. School, Thudhipete Tarikere, Chikmangluru, Karnataka - 577228"|"13.708667000"|"75.815859000"
"433"|"A.A. Group"|"Govt. H.P. School, Sevanagar Keresante"|"Chikmangluru"|"Karnataka"|"-"|"Mon 6.30 pm"|""|"true"|"Govt. H.P. School, Sevanagar Keresante, Chikmangluru, Karnataka - -"|"13.553347600"|"76.011117900"
"434"|"A.A. Group"|"Akshara H.P. School, Ajjampura"|"Chikmangluru"|"Karnataka"|"-"|"Mon 6.00 pm"|"9008384732"|"true"|"Ajjampura, Chikmagalur, Ajjampura Naranapura Road, Chikmagalur, Chikmagalur, Karnataka 577547, India"|"13.726128000"|"76.004116000"
"435"|"A.A. Group"|"Samudayabhavan Neharu Nagar, Near Govt. Hospital, Brahmavara"|"Chikmangluru"|"Karnataka"|"577101"|"Sat 6.00 pm"|""|"true"|"Samudayabhavan Neharu Nagar, Near Govt. Hospital, Brahmavara, Chikmangluru, Karnataka - 577101"|"15.317277000"|"75.713888000"
"436"|"A.A. Group"|"K.V.School, Choultry Street"|"Chikmangluru"|"Karnataka"|"577101"|"Tue 6.00 pm"|""|"true"|"K.V.School, Choultry Street, Chikmangluru, Karnataka - 577101"|"13.553347600"|"76.011117900"
"437"|"A.A. Group"|"Lourds Boys High School,"|"Davangere"|"Karnataka"|"577001"|"Sun 11.00 am"|""|"true"|"Church Rd, P J Extension, MCC A Block, Davangere, Karnataka 577002, India"|"14.462515000"|"75.913479300"
"438"|"A.A. Group"|"Prema Jyothi Convent,"|"Kadur"|"Karnataka"|"577548"|"Sat 6.00 pm"|""|"true"|"Prema Jyothi Convent, , Kadur, Karnataka - 577548"|"13.553347600"|"76.011117900"
"439"|"A.A. Group"|"Saint Marry's Church,"|"Hubli"|"Karnataka"|"580023"|"Sun 11.00 am"|""|"true"|"Keshwapur, Hubballi, Karnataka 580023, India"|"15.357847600"|"75.145173100"
"440"|"A.A. Group"|"Sharada Kids Convent, Shivani Rly Station,"|"Shivani"|"Karnataka"|"-"|"Sun 1.30 am"|"07760101138"|"true"|"Sharada Kids Convent, Shivani Rly Station, , Shivani, Karnataka - -"|"15.317277000"|"75.713888000"
"441"|"A.A. Group"|"St. Anne's Church, Bijapura,"|"Bijapura"|"Karnataka"|"586101"|"Thu 6.00 pm"|""|"true"|"Godbole Mala, Vijayapura, Karnataka 586101, India"|"16.828339500"|"75.715796600"
"442"|"A.A. Group"|"SVS School, B H Road"|"Banavara"|"Karnataka"|"573112"|"Sun 11.00 am"|""|"true"|"SVS School, B H Road, Banavara, Karnataka - 573112"|"13.408420000"|"76.162433000"
"443"|"A.A. Group"|"Vikas School, Police Chowki Vinoba Nagar,"|"Shimoga"|"Karnataka"|"577204"|"Tue 6.30 pm"|""|"true"|"100 ft Road, Beside SUDA Complex, Vinoba Nagar, Shivamogga, Karnataka 577204, India"|"13.950629300"|"75.559964300"
"444"|"A.A. Group"|"D.Ed. College,"|"Antharaghatte"|"Karnataka"|"577550"|"Tue 6.00 pm"|""|"true"|"D.Ed. College, , Antharaghatte, Karnataka - 577550"|"13.553347600"|"76.011117900"
"445"|"Fellowship Group"|"Govt. Hr. Sec. School, Dasanalckenpatti, Namakkal Main Road,"|"Salem"|"Tamilnadu"|"636201"|"Mon 6.00 pm"|"09443858128"|"true"|"Omalur Main Road, First Agraharam, Salem, Tamil Nadu 636001, India"|"11.654904600"|"78.157779300"
"446"|"Freedom Group"|"Vaikal Pattarai School, R.K. Ganesh Theatere, Near Poonnammapet,"|"Salem"|"Tamilnadu"|"636001"|"Wed 7.00 pm"|"09952723247"|"true"|"Vaikal Pattarai School, R.K. Ganesh Theatere, Near Poonnammapet, , Salem, Tamilnadu - 636001"|"11.656049300"|"78.166418900"
"447"|"Holy Group"|"Holy Cross Hr. Sec. School, K.N.Colony, Ammapet,"|"Salem"|"Tamilnadu"|"636003"|"Tue 7.00 pm"|"09786417786"|"true"|"Cuddalore Main Rd, Kandasamy Pudur, Kamarajar Nagar Colony, Ammapet, Salem, Tamil Nadu 636014, India"|"11.663816400"|"78.202867300"
"448"|"Honesty Group"|"Bala Gurugulam School, Opp. SPMM Hospital, Opp. Cuddalore Main Road"|"Salem"|"Tamilnadu"|"636003"|"Thu 7.00 pm"|"09543731212"|"true"|"29, Cuddalore Main Road, Ammapet,, Salem, Tamil Nadu 636003, India"|"11.661240200"|"78.192010200"
"449"|"Lucky Group"|"Udayappatty Panchayat Union, Middle School, Udayappatty"|"Salem"|"Tamilnadu"|"636140"|"Sat 7.00 pm"|"07401235969"|"true"|"MASINAYAKANPATTY, Salem, Tamil Nadu, India"|"11.667254800"|"78.228315400"
"450"|"Nambikkai Group"|"Veeranam Panchayat Union School, Peariyal Veeranam"|"Salem"|"Tamilnadu"|"636122"|"Mon 7.00 pm"|"09543366661"|"true"|"Veeranam Panchayat Union School, Peariyal Veeranam , Salem, Tamilnadu - 636122"|"11.683445300"|"78.216274500"
"451"|"New Bright Group"|"No 61 Sankara Ashramam Nethimedu"|"Salem"|"Tamilnadu"|"636002"|"Mon 7.00 pm"|"09629491243, 09791847109"|"true"|"No 61, Sree Sankara Ashramam, Sankari Main Road, Near Nethimedu Bus Stop, Nethimedu, Salem, Tamil Nadu 636002, India"|"11.637515100"|"78.132641400"
"452"|"New Life Group"|"Corporation's Boys Secondary School, Next to Corporation Office"|"Salem"|"Tamilnadu"|"636001"|"Fri 7.00 pm"|""|"true"|"Corporation's Boys Secondary School, Next to Corporation Office, Salem, Tamilnadu - 636001"|"11.656049300"|"78.166418900"
"453"|"Oothumalai Workshop Group"|"Oothumalai Temple, Near Seelanaickenpatti Bye-pass"|"Salem"|"Tamilnadu"|"636201"|"Thu 7.00 pm"|""|"true"|"Utthumalai, Seelanaickenpatti, Salem, Tamil Nadu 636201, India"|"11.620091700"|"78.150487700"
"454"|"Pudhu Thendral Group"|"Sri Annai Vidhya Malayar School, Near Pacchiman Theater, Gorimedu"|"Salem"|"Tamilnadu"|"636008"|"Tue 7.00 pm"|""|"true"|"Sri Annai Vidhya Malayar School, Near Pacchiman Theater, Gorimedu, Salem, Tamilnadu - 636008"|"11.731461300"|"78.264700400"
"455"|"Rainbow Group"|"Govt. Middle School, Kadayampatti Post, Near Union Office"|"Salem"|"Tamilnadu"|"636351"|"Wed 7.00 pm"|"09787701717"|"true"|"Govt. Middle School, Kadayampatti Post, Near Union Office, Salem, Tamilnadu - 636351"|"11.898178700"|"78.099421000"
"456"|"Rasi Group"|"Municipal Middle School, Near Old Bus Stand, Rasipuram"|"Salem"|"Tamilnadu"|"637408"|"Sat 7.00 pm"|"09865570123"|"true"|"Kamalar, Tiruchengode, Tamil Nadu 637211, India"|"11.379546600"|"77.897110200"
"457"|"Rebirth Group"|"Municipal Middle School, Near Old Bus Stand, Rasipuram"|"Salem"|"Tamilnadu"|"-"|"Sun 12.00 pm"|"09442335985"|"true"|"Kamalar, Tiruchengode, Tamil Nadu 637211, India"|"11.379546600"|"77.897110200"
"458"|"Recovery Group"|"Mount Caramel School, Manakkadu Court Road, Hasthampatti"|"Salem"|"Tamilnadu"|"636007"|"Tue 7.00 pm"|"0427-3113380, 0427-2263950"|"true"|"Mount Caramel School, Manakkadu Court Road, Hasthampatti, Salem, Tamilnadu - 636007"|"11.679470600"|"78.157326100"
"459"|"Recovery Group"|"Primary Health Centre, Manakkadu Bus Stop, Kannankuruchi Main Road, (Nr Salem Medical Centre),"|"Salem"|"Tamilnadu"|"636008"|"All weekdays 7.00 pm"|"09443182206"|"true"|"Kannankurichi Main Rd, MBS Nagar, Manakkadu, Salem, Tamil Nadu 636007, India"|"11.676075100"|"78.163086200"
"460"|"Salem Group"|"Raghuram Colony, Gandhi Road"|"Salem"|"Tamilnadu"|"636007"|"Sun 12.30 pm"|""|"true"|"8Z-A, Gandhi Road, Raghuram Colony, Salem, Tamil Nadu 636007, India"|"11.671275400"|"78.156166300"
"461"|"Serenity Group"|"Bharat Hospital Bangalore Bypass Road, Near Kunnugu Chawdi"|"Salem"|"Tamilnadu"|"636007"|"Sat 7.00 pm"|""|"true"|"Bharat Hospital Bangalore Bypass Road, Near Kunnugu Chawdi, Salem, Tamilnadu - 636007"|"11.674677500"|"78.143615900"
"462"|"Sharvaroys Group"|"Panchayat Primary School, Veemanoor, Chinnanur P.O."|"Salem"|"Tamilnadu"|"636122"|"Wed 7.30 pm"|""|"true"|"Panchayat Primary School, Veemanoor, Chinnanur P.O., Salem, Tamilnadu - 636122"|"11.731461300"|"78.264700400"
"463"|"Steel Group"|"Tharamangalam Road, Steel Plant, IIIrd Gate"|"Salem"|"Tamilnadu"|"636302"|"Thu 7.00 pm"|""|"true"|"Tharamangalam Road, Steel Plant, IIIrd Gate, Salem, Tamilnadu - 636302"|"11.676237600"|"78.013830600"
"464"|"Surrender Group"|"St. Sacred Church, (St. Joseph Girls Secondary School), Suramangalam"|"Salem"|"Tamilnadu"|"636005"|"Mon 7.00 pm"|""|"true"|"Suramangalam, Salem, Tamil Nadu 636005, India"|"11.676637800"|"78.117635900"
"465"|"True Friends Group"|"Corporation Primary School, Jalalkhan St., Fort"|"Salem"|"Tamilnadu"|"636001"|"Mon 7.30 pm"|"09842361000, 09842710399, 0427-2415515"|"true"|"Corporation Primary School, Jalalkhan St., Fort, Salem, Tamilnadu - 636001"|"11.655812900"|"78.160718600"
"466"|"Unity Group"|"Shivangi Ammaliyar Corporation Boy's Higher Secondary School, Tiruvika Road"|"Salem"|"Tamilnadu"|"-"|"Sun 7.30 pm"|""|"true"|"Shivangi Ammaliyar Corporation Boy's Higher Secondary School, Tiruvika Road, Salem, Tamilnadu - -"|"11.658096900"|"78.182093100"
"467"|"Welcome Group"|"TVS Back Side BSNL Tower, Ammapet Immanual Prayer Fellowship, 325/205 Ammapet Main Road"|"Salem"|"Tamilnadu"|"636001"|"Sun 7.30 pm"|"09952663398"|"true"|"506/1 BSNL TOWER, TVS showroom Backside, TVK Rd, Balaji Nagar, Ammapet, Salem, Tamil Nadu 636003, India"|"11.658298000"|"78.174847200"
"468"|"Winner Group"|"Masinaikan Patti High School, Masinaickenpatti"|"Salem"|"Tamilnadu"|"636103"|"Sun 7.00 pm"|"09994237653"|"true"|"Masinaikan Patti High School, Masinaickenpatti, Salem, Tamilnadu - 636103"|"11.672670600"|"78.196340400"
"469"|"Wisdom Group"|"Salem Corporation Primary School, Arunachal Asari Street, (E.B. Office Premises)"|"Salem"|"Tamilnadu"|"-"|"Thu 7.00 pm"|""|"true"|"Salem Corporation Primary School, Arunachal Asari Street, (E.B. Office Premises), Salem, Tamilnadu - -"|"11.652270000"|"78.160531000"
"470"|"Pulari Group"|"St. Thomas Church, Kallaippara, Erumamunda"|"Malappuram"|"Kerala"|"679334"|"Sun 4.00 pm"|"09496584702"|"true"|"St. Thomas Church, Kallaippara, Erumamunda,  Malappuram, Kerala - 679334"|"11.073182000"|"76.074000000"
"471"|"Amrutham Group"|"A L P School, Pallikkal Bazar"|"Malappuram"|"Kerala"|"673634"|"Sun 4.00 pm"|"07025240171"|"true"|"Kakkanchery-Kottappuram Road, Pallikal, Kerala 673634, India"|"11.149954100"|"75.913336300"
"472"|"City Group"|"G L P School, Opp Aarya Vaidyasala Factory, Kottakkal"|"Malappuram"|"Kerala"|"676503"|"Sun 4.00 pm"|"09447580580"|"true"|"Arya Vaidya Sala Road , Kottakkal, Malappuram, Kerala 676503, India"|"10.996956500"|"76.008906100"
"473"|"Daya Group"|"A L P School, Vyapparappadi, Malappuram Road, Manjeri"|"Malappuram"|"Kerala"|"676121"|"Sun 4.30 pm"|"08589918880"|"true"|"Punnakuzhi Road, Manjeri, Malappuram, Kerala 676121, India"|"11.137012000"|"76.121485100"
"474"|"Namma Group"|"Girls HSS Manjeri, Kozhikode Road, Manjeri"|"Malappuram"|"Kerala"|"676121"|"Sun 5.00 pm"|"09846250654"|"true"|"Calicut Rd, Karuvambram, Manjeri, Kerala 676121, India"|"11.120296500"|"76.117873200"
"475"|"Aaswas Group"|"Marthoma School, Ponani"|"Malappuram"|"Kerala"|"679577"|"Sun 5.00 pm"|"09249222559"|"true"|"Marthoma School, Ponani ,  Malappuram, Kerala - 679577"|"10.767720000"|"75.925901000"
"476"|"Pulari Group"|"High School Ppadi SMLP School, Vandoor Road, Pandikkad,"|"Malappuram"|"Kerala"|"676521"|"Sun 6.30 pm"|"09495075619"|"true"|"High School Ppadi SMLP School, Vandoor Road, Pandikkad, ,  Malappuram, Kerala - 676521"|"11.092555000"|"76.223288000"
"477"|"Punarjani Group"|"Steps English Medium Nurery School, Thurakkal, kondotty"|"Malappuram"|"Kerala"|"673638"|"Sun 6.30 pm"|"09388080111"|"true"|"Steps English Medium Nurery School, Thurakkal, kondotty ,  Malappuram, Kerala - 673638"|"11.145841000"|"75.964259000"
"478"|"Thanal Group"|"A L P School, Paaloor"|"Malappuram"|"Kerala"|"679323"|"Sun 6.30 pm"|"09946271439"|"true"|"Malappuram, Paloor, Pulamanthole, Kerala 679323, India"|"10.916148800"|"76.190192500"
"479"|"Swastham Group"|"Anganwadi Bldg, Karad"|"Malappuram"|"Kerala"|"679339"|"Sun 4.30 pm"|"09447412541"|"true"|"Anganwadi Bldg, Karad ,  Malappuram, Kerala - 679339"|"11.243092000"|"76.249360000"
"480"|"Nandi Group"|"G U P School, Kozhikode Road, Patakkulam"|"Malappuram"|"Kerala"|"695572"|"Sun 7.00 pm"|"09656543990"|"true"|"G U P School, Kozhikode Road, Patakkulam ,  Malappuram, Kerala - 695572"|"11.073182000"|"76.074000000"
"481"|"Navjeevan Group"|"C S D Hall, Ucharakkadavu, Mannarkkadu Road"|"Malappuram"|"Kerala"|"686518"|"Mon 6.00 pm"|"09656898794"|"true"|"Melattur-Mannarkkad Rd, Kerala, India"|"11.001027400"|"76.371867500"
"482"|"Piravi Group"|"St. Joseph Church, Kozhikode Road, Manjeri"|"Malappuram"|"Kerala"|"676121"|"Mon 6.30 pm"|"08086547901"|"true"|"Sanjo Nagar - Kaaloor Road, Near MIMS Hospital, Kozhikode, Kerala 673007, India"|"11.242711500"|"75.798688300"
"483"|"Mochanam Meeting"|"Manjeri Medical College, Malappuram Road"|"Malappuram"|"Kerala"|"676121"|"Mon 6.30 pm"|"07560909779"|"true"|"Hospital Road, Vellarangal, Manjeri, Kerala 676121, India"|"11.116183200"|"76.120658700"
"484"|"Athijeevan Group"|"G M L P School, Opp Tirur Nursing Home"|"Malappuram"|"Kerala"|"679343"|"Mon 6.30 pm"|"09447423770"|"true"|"District Malappuram, Tirur, Kerala 676101, India"|"10.913993500"|"75.922466800"
"485"|"Karuna Group"|"St Jammas School, Kunnummal"|"Malappuram"|"Kerala"|"673011"|"Tue 6.30 pm"|"0846088379"|"true"|"UpHill, NH 213, Up Hill, Malappuram, Kerala 676505, India"|"11.041313600"|"76.080616200"
"486"|"Pratheeksha Group"|"GLP School, Pookkalathoor Road, Palazhi"|"Malappuram"|"Kerala"|"673014"|"Tue 6.30 pm"|"09142340269"|"true"|"GLP School, Pookkalathoor Road, Palazhi ,  Malappuram, Kerala - 673014"|"11.248681000"|"75.843228000"
"487"|"Samarpan Group"|"Elite Library, Kuttipuram"|"Malappuram"|"Kerala"|"679571"|"Tue 6.30 pm"|""|"true"|"Elite Library, Kuttipuram ,  Malappuram, Kerala - 679571"|"10.842308000"|"76.030487000"
"488"|"A A Meeting"|"Ansar Hospital"|"Malappuram"|"Kerala"|"680519"|"4th Wed 10.00 am"|"09388717132"|"true"|"SH 69, Ansar Nagar, Perumpilavu, Karikkad, Thrissur, Kerala 680519, India"|"10.703329200"|"76.089648600"
"489"|"A A Edapal Group"|"Near Mother Institute, Edappal"|"Malappuram"|"Kerala"|"679576"|"Wed 6.00 pm"|"09447545458"|"true"|"Palakkad - Ponnani Rd, Edappal, Kerala 679576, India"|"10.781793600"|"76.012483800"
"490"|"Recovery Group"|"ME T School, Pandikadu Road, Payyanad"|"Malappuram"|"Kerala"|"676122"|"Wed 6.30 pm"|"09539642683"|"true"|"High School Rd, Nellikuth, Kerala 676122, India"|"11.100372700"|"76.184982100"
"491"|"A A Message Meeting"|"Prashanti Hospital, Court Road, Manjeri"|"Malappuram"|"Kerala"|"676121"|"Wed 6.30 pm"|"09539642683"|"true"|"Court Road, Manjeri, Kerala 676121, India"|"11.115872000"|"76.118572600"
"492"|"Soubhagya Group"|"KMMAUP School, Cherukode, Wandoor Road"|"Malappuram"|"Kerala"|"679336"|"Wed 6.00 pm"|"09745320484"|"true"|"Manjeri-Kuttippara â€“ Cherukode-Wandoor Road, Cherucode, Kerala 679328, India"|"11.161708300"|"76.228809400"
"493"|"Sangamam Group"|"Pain and Paliative Centre, Kunnupuram"|"Malappuram"|"Kerala"|"676302"|"Wed 6.30 pm"|"09895718404"|"true"|"Pain and Paliative Centre, Kunnupuram,  Malappuram, Kerala - 676302"|"11.085291000"|"75.951233000"
"494"|"Angel Group"|"A. U. P . School, Areekode"|"Malappuram"|"Kerala"|"673639"|"Thu 6.30 pm"|"08086836614"|"true"|"Kozhakkottoor Bus Stop, Salafi Masjid, Kondotty-Areecode Rd, Kozhakottur, Areacode, Kerala 673639, India"|"11.223272300"|"76.047529900"
"495"|"Sancharam Group"|"Govt. Hospital, Kalikavu"|"Malappuram"|"Kerala"|"676525"|"Thu 6.30 pm"|"09656413614"|"true"|"Kalikavu, Kerala 676525, India"|"11.177342200"|"76.315035900"
"496"|"Sneha Group"|"Opp. Bustand, Viswabharathi College, Tirur"|"Malappuram"|"Kerala"|"676101"|"Thu 6.30 pm"|"09388717132"|"true"|"Opp. Bustand, Viswabharathi College, Tirur ,  Malappuram, Kerala - 676101"|"10.914627000"|"75.922093000"
"497"|"Just for Today Group"|"G. M. U. P. School, Aryavaidya Sala Road, Kottakkal"|"Malappuram"|"Kerala"|"676503"|"Thu 6.30 pm"|"09947081977"|"true"|"Arya Vaidya Sala Road , Kottakkal, Malappuram, Kerala 676503, India"|"10.996956500"|"76.008906100"
"498"|"Saneevani Group"|"G. M. L. P. Scool, Wandoor Road, Pandikkad"|"Malappuram"|"Kerala"|"676521"|"Thu 6.30 pm"|"09605277264"|"true"|"G. M. L. P. Scool, Wandoor Road, Pandikkad ,  Malappuram, Kerala - 676521"|"11.092555500"|"76.223288000"
"499"|"Miracle Group"|"N. S. S. College Road, Manjeri"|"Malappuram"|"Kerala"|"679121"|"Fri 6.30 pm"|""|"true"|"State, India, College Rd, Manjeri, Kerala, India"|"11.118254000"|"76.128945000"
"500"|"Aashrayam Group"|"A .L. P. School, Valancherry"|"Malappuram"|"Kerala"|"676552"|"Fri 6.30 pm"|"09544702466"|"true"|"LP School Road, Kattipparuthi, Kerala 676552, India"|"10.898955500"|"76.072487000"
"501"|"Victory Group"|"Girls Hss School, Kottappadi"|"Malappuram"|"Kerala"|"676503"|"Fri 6.30 pm"|"07558892936"|"true"|"Kottakkal, Malappuram, Kerala 676503, India"|"10.991089000"|"75.995131500"
"502"|"Sparsham Group"|"A. L. P. School, Near Railway Bridge, Puthantheru"|"Malappuram"|"Kerala"|"676101"|"Fri 6.30 pm"|"09746871855"|"true"|"A. L. P. School, Near Railway Bridge, Puthantheru ,  Malappuram, Kerala - 676101"|"10.863574000"|"75.890792000"
"503"|"Prathasaya Group"|"Marthoma Hospital, Chungathara"|"Malappuram"|"Kerala"|"679334"|"Sat 3.30 pm"|"09447038979"|"true"|"Chungathara, Kerala 679334, India"|"11.331241000"|"76.272763500"
"504"|"Town Group"|"Winners Sports Academy, Near Aamina Hospital, Angaadippuram, Perinthalmanna"|"Malappuram"|"Kerala"|"679121"|"Sat 6.30 pm"|"09544761410"|"true"|"24, Ootty Rd, Perinthalmanna, Kerala 679322, India"|"10.977679400"|"76.223695400"
"505"|"Unity Group"|"Govt. Boys High School, Kacherippadi, Manjeri"|"Malappuram"|"Kerala"|"676517"|"Sat 6.30 pm"|"09946564049"|"true"|"Vellarangal Manjeri, Kerala 676517 India, Manjeri, Kerala 676517, India"|"11.111092100"|"76.120414600"
"506"|"Vijayam Group"|"Kottakkal Aryavaidya Sala, Kottakkal"|"Malappuram"|"Kerala"|"676503"|"Sat 6.30 pm"|"09526022650"|"true"|"Arya Vaidya Sala Road , Kottakkal, Malappuram, Kerala 676503, India"|"10.996956500"|"76.008906100"
"507"|"Aasha Deepam Group"|"Aiswarya Building, Edappal Road, Thattanpadi"|"Malappuram"|"Kerala"|"679576"|"Sat 6.30 pm"|"09249222559"|"true"|"Aiswarya Building, Edappal Road, Thattanpadi,  Malappuram, Kerala - 679576"|"10.786643000"|"75.990610000"
"508"|"Parinamam Group"|"Vennayoor A. U. P. B. School, Ayikkarapadi"|"Malappuram"|"Kerala"|"673637"|"Sat 6.30 pm"|"09747117072"|"true"|"Ayikkarapadi, Kerala 673637, India"|"11.176299400"|"75.895907300"
"509"|"Nirbhaya Group"|"Govt. HSS School, Pallippuram"|"Malappuram"|"Kerala"|"688541"|"Sat 6.30 pm"|"08129279115"|"true"|"Cherthala Arookutty Road, Pallipuram, Kerala 688541, India"|"9.746927800"|"76.363638000"
"510"|"Wisdom Group"|"G. U. P. School, Azhinjilam"|"Malappuram"|"Kerala"|"673632"|"Sat 6.30 pm"|"09605192688"|"true"|"Azhinjilam Karad Road, Azhinjilam, Ramanattukara, Kerala 673632, India"|"11.200567200"|"75.869060700"
"511"|"Aiswaraya Group"|"A. U. P. School, Eravannur"|"Kozhikode"|"Kerala"|"673585"|"Sun 6.30 pm"|"09496915499"|"true"|"Eravannur - Palath Rd, Pullaloor, Kerala 673585, India"|"11.356692700"|"75.843216400"
"512"|"Navodaya Morning Group"|"K K Hospital, Balussery"|"Kozhikode"|"Kerala"|"673612"|"Sun 7.00 pm"|"08281044433"|"true"|"SH34, Arappeedika, Balussery, Kerala 673612, India"|"11.445722600"|"75.836187600"
"513"|"Sunday Group"|"A. U. P. School, Panangadu North, Kannadippoyil"|"Kozhikode"|"Kerala"|"673612"|"Sun 6.30 pm"|"09961398775"|"true"|"A. U. P. School, Panangadu North, Kannadippoyil,  Kozhikode, Kerala - 673612"|"11.258753000"|"75.780410000"
"514"|"Navjeevan Group"|"St. Mary'S Church Hall, Erappamthodu"|"Kozhikode"|"Kerala"|"673001"|"Mon 6.30 pm"|"09495090489"|"true"|"St. Mary'S Church Hall, Erappamthodu,  Kozhikode, Kerala - 673001"|"11.258753000"|"75.780410000"
"515"|"Namma Group"|"A. U. P. School, Nanmanda"|"Kozhikode"|"Kerala"|"673613"|"Mon 6.30 pm"|"09495721648"|"true"|"Kozhikode Balussery Rd, Nanminda, Kerala 673613, India"|"11.421102600"|"75.831878800"
"516"|"Navodaya Group"|"Oxford College , Balusserry"|"Kozhikode"|"Kerala"|"673613"|"Tue /Fri 6.30 pm"|"09495640752"|"true"|"Oxford College , Balusserry ,  Kozhikode, Kerala - 673613"|"11.258753000"|"75.780410000"
"517"|"Mochanam Group"|"A. L. P. School , Palath (Canal Road), Chelannur"|"Kozhikode"|"Kerala"|"673616"|"Tue 7.00 pm"|"09746473756"|"true"|"A. L. P. School , Palath (Canal Road), Chelannur ,  Kozhikode, Kerala - 673616"|"11.357631000"|"75.807721000"
"518"|"Namma Group"|"Priliance Building, Thalayad"|"Kozhikode"|"Kerala"|"673574"|"Wed 6.30 pm"|"09447621278"|"true"|"Priliance Building, Thalayad ,  Kozhikode, Kerala - 673574"|"11.258753000"|"75.780410000"
"519"|"Piravi Group"|"Prathibha College, Koottalida"|"Kozhikode"|"Kerala"|"673614"|"Thu 6.30 pm"|"09846457103"|"true"|"Prathibha College, Koottalida ,  Kozhikode, Kerala - 673614"|"11.496185000"|"75.811223000"
"520"|"Rajgiri Group"|"Kaladarshan, M. A. Bazar , Ekarool"|"Kozhikode"|"Kerala"|"673574"|"Thu 6.30 pm"|"09539865371"|"true"|"Kaladarshan, M. A. Bazar , Ekarool ,  Kozhikode, Kerala - 673574"|"11.442733000"|"75.879538000"
"521"|"N R Pura Group"|"N K Pura Social Welfare Building Bathimut N R Pura"|"Chikmangalure Kadur"|"Karnataka"|"577548"|"Wed 4.00 pm"|"09449723694"|"true"|"N K Pura Social Welfare Building Bathimut N R Pura, Chikmangalure Kadur, Karnataka - 577548"|"15.279683000"|"75.230404000"
"522"|"Niduwale Group"|"Niduwale Higher Primary School"|"Chikmangalure Kadur"|"Karnataka"|"577548"|"Fri 5.00 pm"|"09482031834"|"true"|"Niduwale Higher Primary School, Chikmangalure Kadur, Karnataka - 577548"|"14.495319000"|"74.422426000"
"523"|"Tirthahalli Group"|"Thirthahalli Govt. PU College, Near Bantara Bhavana, Kuvempu Road"|"Chikmangalure Kadur"|"Karnataka"|"577432"|"Mon/Thu/Sat 6.00 pm"|""|"true"|"Thirthahalli Govt. PU College, Near Bantara Bhavana, Kuvempu Road, Chikmangalure Kadur, Karnataka - 577432"|"13.938087000"|"75.569081000"
"524"|"Uttameshwara Group"|"Uttameshwara Higher Primary School, Uttameshwara"|"Chikmangalure Kadur"|"Karnataka"|"577126"|"Sat 6.00 pm"|"09482632859"|"true"|"Uttameshwara Higher Primary School, Uttameshwara, Chikmangalure Kadur, Karnataka - 577126"|"15.317277000"|"75.713888000"
"525"|"A.A. Group"|"Honnali Kalkere Garadi Mane"|"Chitradurga"|"Karnataka"|"577501"|"Fri 8.30 am"|"09611452483"|"true"|"Honnali Kalkere Garadi Mane, Chitradurga, Karnataka -  577501"|"14.230559000"|"76.398454000"
"526"|"Chitradurga Group"|"Anubhava Mantapa, Shri Murugamut"|"Chitradurga"|"Karnataka"|"577501"|"Sun 12.00 am"|"098459103617"|"true"|"Anubhava Mantapa. Sri Murugha Matha, Kavadigarahatti Layout, Matadakurubarahatti, Karnataka 577501, India"|"14.237179500"|"76.375588900"
"527"|"A.A. Group"|"Chikka Basur Thanda"|"Davangere"|"Karnataka"|"577001"|"Daily 7.00 pm"|"09845903617"|"true"|"Chikka Basur Thanda, Davangere, Karnataka - 577001"|"14.466344000"|"75.923840000"
"528"|"Davangere Group"|"Lourdes Boys High School"|"Davangere"|"Karnataka"|"577001"|"Sun 10.30 am"|"08050384961"|"true"|"Church Rd, P J Extension, MCC A Block, Davangere, Karnataka 577002, India"|"14.462515000"|"75.913479300"
"529"|"A.A. Group"|"Ashraya Hospital, 4th Cross Road, Sampige Road, K.B. Pura"|"Hassan"|"Karnataka"|"573201"|"Sat 12.30 pm"|"09482802797"|"true"|"Ashraya Hospital, 4th Cross Road, Sampige Road, K.B. Pura, Hassan, Karnataka - 573201"|"13.029833700"|"76.567607100"
"530"|"A.A. Group"|"Mount Carmel School, Compound Belur"|"Hassan"|"Karnataka"|"573213"|"Mon 5.30 pm"|""|"true"|"JP Nagar, Gotravalli, Karnataka 573115, India"|"13.163949700"|"75.856738100"
"531"|"A.A. Group"|"Municiple School (Nullipadi School), Press Club Junction, Kasargod"|"Kerala Kasargod"|"Karnataka"|"671121"|"Sun 10.00 am"|""|"true"|"Municiple School (Nullipadi School), Press Club Junction, Kasargod , Kerala Kasargod, Karnataka - 671121"|"15.317282300"|"75.713893200"
"532"|"Madikeri Group"|"Shanthi Church, Opp East End Hotel, Madikeri"|"Madikeri"|"Karnataka"|"571201"|"Fri 2.00 pm"|"09880316013"|"true"|", Near R.T.O. Office, G.T. Circle, Madikeri, Karnataka 571201, India"|"12.416860000"|"75.744560000"
"533"|"A.A. Group"|"Balmata Govt. Junior College, Opp. Jyothi Talkies"|"Mangalore"|"Karnataka"|"575001"|"Tue/Thu/ 6.00 pm and Sun 10.15 am"|""|"true"|"Balmatta Road, Ambedkar Circle, Near Jyothi Signal, Mangaluru, Karnataka 575001, India"|"12.872709200"|"74.848188600"
"534"|"A.A. Group"|"Church School, Compound Meremajal"|"Mangalore"|"Karnataka"|"575001"|"Sun 9.00 pm"|""|"true"|"Church School, Compound Meremajal, Mangalore, Karnataka - 575001"|"12.914141800"|"74.855956900"
