MeetingID|GroupName|Address|Area|State|PostCode|Day_Time|Contact|PartialMatch|FormattedAddress|Exact_Lat|Exact_Lng
"1"|"Aashraya Group."|"St. Anthony's Church Vaddy,"|"Kollam"|"Kerala"|"691006"|"Wed 7.00 pm"|"09895588945"|"true"|"Mulakkada Mukku-Vaddy Rd, Thangasherry East, Thangassery, Kollam, Kerala 691013, India"|"8.885396200"|"76.576060400"
"2"|"Norbert Bhavan Group."|"Norbert Bhavan, Eravipuram Jn."|"Kollam"|"Kerala"|"691011"|"Thu 7.00 pm"|"09947731123"|"true"|"Norbert Bhavan, Eravipuram Jn., Kollam, Kerala - 691011"|"8.859614000"|"76.619610000"
"3"|"Friday Group."|"YMCA,"|"Kollam"|"Kerala"|"673019"|"Fri 7.00 pm"|"09048263719"|"true"|"YMCA Road, Chinnakkada, Kollam, Karbala, Kerala, 691001, India"|"8.883882100"|"76.592063900"
"4"|"Hope Group."|"Cherupushpam School, Ayoor, Kollam"|"Kollam Dist"|"Kerala"|"691533"|"Mon 6.30 pm (Closed Meeting)"|"09496106939"|"true"|"SH 1, Edamulackal, Kerala 691533, India"|"8.901039300"|"76.859078500"
"5"|"Orion Group."|"Marthoma Church, Kollaka, Near Kannety, Karunagappally"|"Kollam Dist"|"Kerala"|"690518"|"Tue 7.00 pm (Closed Meeting)"|"09497688496, 09846508524"|"true"|"Kollaka, Karunagappally, Kerala 690536, India"|"9.040367300"|"76.540243000"
"6"|"Jeevan Group."|"Kadavoor, L.P. School, Kadavoor, Kollam"|"Kollam Dist"|"Kerala"|"686671"|"Tue 7.00 pm (Closed Meeting)"|"09605986693, 09446018696"|"true"|"Kadavoor, L.P. School, Kadavoor, Kollam, Kollam Dist, Kerala - 686671"|"10.001008000"|"76.741588000"
"7"|"New Vision Group."|"St. Mary's L.P.S, Anjilimoodu, Sasthamcotta"|"Kollam Dist"|"Kerala"|"690521"|"Wed 7.00 pm (Closed Meeting)"|"09656683354"|"true"|"St. Mary's L.P.S, Anjilimoodu, Sasthamcotta, Kollam Dist, Kerala - 690521"|"9.036461000"|"76.623942000"
"8"|"Light House Group."|"Infant Jesus H.S.S., Thangassery, Kollam"|"Kollam Dist"|"Kerala"|"691007"|"Wed 7.00 pm (Closed Meeting)"|"09895135872"|"true"|"Thangasherry East, Thangassery, Kerala 691007, India"|"8.884521600"|"76.565045400"
"9"|"Bodhi Group."|"St. Vincent ICSE School, Keralapuram, Kollam"|"Kollam Dist"|"Kerala"|"691014"|"Fri 7.00 pm (Closed Meeting)"|"08086920986"|"true"|"PERUMPUZHA P.O., KERALAPURAM KOLLAM-691504 KERALA, Kollam-Tirumangalam Road, Keralapuram, Kerala 691014, India"|"8.946111700"|"76.661701500"
"10"|"Shanthi Group."|"Marthoma Jubilee Convention Centre, Pulamon, Kottarakkara"|"Kollam Dist"|"Kerala"|"691542"|"Sat 7.00 pm (Closed Meeting)"|"09745688026, 09961021968"|"true"|"Marthoma Jubilee Convention Centre, Pulamon, Kottarakkara, Kollam Dist, Kerala - 691542"|"9.001664000"|"76.800178000"
"11"|"Touch Up Group"|"Akshara Youth Center"|"Kondotty"|"Kerala"|"673638"|"Fri 6.30 pm"|"09947318504"|"true"|"Akshara Youth Center , Kondotty, Kerala - 673638"|"11.145840500"|"75.964258700"
"12"|"Prateeksha Group"|"Kasthurba Hospital, Thokkilangadi"|"Koothuparamba"|"Kerala"|"670643"|"Sat 6.00 pm"|"09495494247"|"true"|"Thalassery - Baveli Rd, Kerala 670643, India"|"11.842691300"|"75.569758000"
"13"|"Chaithanya Group."|"Nandavanam Auditorium, Near Temple, Ettumanoor,"|"Kottayam"|"Kerala"|"686631"|"Wed 6.30 pm"|"09447370463, 09961690406"|"true"|"Ettumanoor, Kerala 686631, India"|"9.673022300"|"76.560107100"
"14"|"Abhayam Group."|"NSS Auditorium, Near Sreekrishna Temple, Kanakkary,"|"Kottayam"|"Kerala"|"686632"|"Sat 6.45 pm"|"09447038765, 08281237602"|"true"|"NSS Auditorium, Near Sreekrishna Temple, Kanakkary,, Kottayam, Kerala - 686632"|"9.705885300"|"76.543042900"
"15"|"Gracious Group."|"Lourds Church Permises, Opp. Collectorate Kottayam,"|"Kottayam"|"Kerala"|"686004"|"Sun 4.00 pm"|"09605404575"|"true"|"Collectorate Junction, Eerayil Kadavu, Kottayam, Kerala 686002, India"|"9.587920200"|"76.534012600"
"16"|"Badseda Group."|"I.H.M. (Maryagiri) Hospital, Bharanganam, Pala,"|"Kottayam"|"Kerala"|"686575"|"Sun 2.30 pm"|"09447517163"|"true"|"Bharanaganam, Kottayam, Kerala 686578, India"|"9.703459100"|"76.720395900"
"17"|"Asraya Group."|"C.S.I. Ascension Sevana Nilayam, Near Medical College, Gandhi Nagar,"|"Kottayam"|"Kerala"|"686008"|"Fri 7.00 pm"|"09497893904"|"true"|"Gandhinagar PO, Kottayam, Kerala 686008, India"|"9.631918000"|"76.521610000"
"18"|"Athani Group."|"Baker School Permises, Baker Jn.,"|"Kottayam"|"Kerala"|"686001"|"Sat 6.30 pm"|"09447570866"|"true"|"Baker Hill, Kottayam, Kerala 686001, India"|"9.593364000"|"76.524151700"
"19"|"Puthuppally Group."|"St. George Church Compound, Puthuppally,"|"Kottayam"|"Kerala"|"686010"|"Fri 6.30 pm"|"09961663287"|"true"|"Manarcadu Thenganal Rd, Near SBI ATM, Puthuppally P.O, Kottayam, Kerala 686011, India"|"9.551932000"|"76.567169000"
"20"|"Kuamaloor Group."|"St. Mary's Church Compound, Kudamaloor,"|"Kottayam"|"Kerala"|"696017"|"Sun 7.00 pm"|"09446458546"|"true"|"Kudamaloor, Kottayam, Kerala 686017, India"|"9.622195300"|"76.513987900"
"21"|"Anugraha Group."|"St. Thomas Hospital, Cethyppuzha, Changanachery,"|"Kottayam"|"Kerala"|"686101"|"Wed 6.30 pm"|"09497226103"|"true"|"Kurisummoodu P.O, Chethipuzha Kadavu, Changanassery, Kerala 686104, India"|"9.462208800"|"76.552813400"
"22"|"Mochana Group."|"Mochana De-Adiction Center, Manganam,"|"Kottayam"|"Kerala"|"686018"|"Thu 6.30 pm"|"09446119340"|"true"|"Bethel Marthoma Church, Manganam, Kottayam, Kerala 686018, India"|"9.567919000"|"76.559339900"
"23"|"Gracious Group"|"Lourdes"|"Kottayam"|"Kerala"|"686001"|"Sun 4.30 pm"|"09447570866"|"true"|"Opp. M.D.C. Centre, K.K. Road, Kottayam, Kerala 686001, India"|"9.588863000"|"76.530247000"
"24"|"Jyothis Group"|"S.N.D.P. School, Mariyappilly P.O. Nattakom"|"Kottayam"|"Kerala"|"686013"|"Sat 7.00 pm"|"09495215755"|"true"|"Pakkil Power House Road, Pakkil, Kottayam, Kerala 686012, India"|"9.543584500"|"76.517683900"
"25"|"M.C.H. Group"|"Council Hall Ward No.4, Medical College Hospital, Gandhinagar"|"Kottayam"|"Kerala"|"686008"|"Wed 10.00 am"|"09447567467"|"true"|"Gandhi Nagar, Kottayam, Kerala 686008, India"|"9.632415100"|"76.520733600"
"26"|"Saphalya Group"|"BSNL Quarters, Ponkkunam"|"Kottayam"|"Kerala"|"686501"|"Sun 6.00 pm"|"09446302411"|"true"|"Kollam -Theni Hwy, Ponkunnam, Kerala 686506, India"|"9.565119400"|"76.742369200"
"27"|"Newman Group"|"St. Augustine"|"Kottayam Dist"|"Kerala"|"686576"|"Sun 2.30 pm"|"04822261224"|"true"|"Ramapuram Main Junction, Ramapuram, Kottayam, Kerala 686576, India"|"9.800374300"|"76.663242400"
"28"|"Adarsh Group."|"Meppayur A.L.P. School, Meppayur,"|"Koyilandy"|"Kerala"|"673524"|"Sun 6.30 pm"|"09496070455"|"true"|"Meppayur, Kerala 673524, India"|"11.544608600"|"75.719726800"
"29"|"Prarthana Group."|"Pookkad Puthanvalappu U.P. School,"|"Koyilandy"|"Kerala"|"673305"|"Mon 6.30 pm"|"08086197810"|"true"|"Pookkad Puthanvalappu U.P. School,, Koyilandy, Kerala - 673305"|"11.444647000"|"75.693532000"
"30"|"Varada Group."|"Our College, Kollam,"|"Koyilandy"|"Kerala"|"673305"|"Tue 6.30 pm"|"09946187478"|"true"|"Viyyur, Koyilandy, Kerala 673305, India"|"11.458490800"|"75.689792600"
"31"|"Chaithanya Group."|"Sreeramanada Asramam School, Chengottukavu,"|"Koyilandy"|"Kerala"|"673305"|"Wed 6.30 pm"|"09048873365"|"true"|"Sreeramanada Asramam School, Chengottukavu,, Koyilandy, Kerala - 673305"|"11.418808000"|"75.724849000"
"32"|"Sahrudaya Group."|"BSM College, Near New Bus Stand,"|"Koyilandy"|"Kerala"|"673305"|"Thu 6.30 pm"|"09995547421, 08943733527"|"true"|"SH34, Koyilandy, Kerala 673305, India"|"11.440146700"|"75.696160200"
"33"|"Abhayam Group."|"Talent College, Near New Busstand,"|"Koyilandy"|"Kerala"|"673305"|"Fri 6.30 pm"|"09946785848, 09947162784"|"true"|"Talent College, Near New Busstand,, Koyilandy, Kerala - 673305"|"11.441113000"|"75.695532000"
"34"|"Velicham Group."|"Ujayini Kalaksethram, Peruvatoor,"|"Koyilandy"|"Kerala"|"673305"|"Sat 6.30 pm"|"09048892779, 09048946304"|"true"|"Ujayini Kalaksethram, Peruvatoor,, Koyilandy, Kerala - 673305"|"11.444647000"|"75.700000000"
"35"|"Anugraha Group."|"Parish Hall, Theyyappara"|"Kozhikode"|"Kerala"|"673573"|"Mon 6.30 pm"|"09744427463"|"true"|"Parish Hall, Theyyappara, Kozhikode, Kerala - 673573"|"11.403605000"|"75.977323000"
"36"|"Dhanya Group."|"Step Study Meeting Group Office, Near SBT Church Building, Thiruvambady"|"Kozhikode"|"Kerala"|"673603"|"Tue 6.00 pm"|"09846694427"|"true"|"Step Study Meeting Group Office, Near SBT Church Building, Thiruvambady, Kozhikode, Kerala - 673603"|"11.363227000"|"76.010177000"
"37"|"Freedom Group."|"Parish Hall, Valiyakolli"|"Kozhikode"|"Kerala"|"673580"|"Tue 6.30 pm"|"09846358523, 9495365361"|"true"|"Parish Hall, Valiyakolli, Kozhikode, Kerala - 673580"|"11.428038000"|"76.023588000"
"38"|"Grace Group."|"St. Sebastian's L.P.School, Koddaranji"|"Kozhikode"|"Kerala"|"673603"|"Fri 6.30 pm"|""|"true"|"Maranchatty Rd Koodaranhi, Koodaranji, Kerala 673603, India"|"11.342892000"|"76.039859000"
"39"|"Haritha Group."|"Pain and Paliative Centre, Kaithapoyil"|"Kozhikode"|"Kerala"|"673586"|"Tue 6.30 pm"|"09495859307, 09447420275"|"true"|"Pain and Paliative Centre, Kaithapoyil, Kozhikode, Kerala - 673586"|"11.481024000"|"75.996183000"
"40"|"Jeevan Group."|"St. Thomas U.P.School, Kallurutty"|"Kozhikode"|"Kerala"|"673582"|"Wed 6.30 pm"|"09562147998, 09947052958"|"true"|"St. Thomas U.P.School, Kallurutty, Kozhikode, Kerala - 673582"|"11.358390000"|"75.988775000"
"41"|"Jyothis Group."|"Church Building, Kannoth"|"Kozhikode"|"Kerala"|"673531"|"Wed 6.30 pm"|"09496422980, 09446183092"|"true"|"Thiruvampadi â€“ Kodenchery-Puduppady Road, Kannoth, Kerala 673580, India"|"11.457965000"|"76.002334400"
"42"|"Kripa Group."|"St. Mary's Parish Hall, Kodencherry"|"Kozhikode"|"Kerala"|"673573"|"Sat 6.30 pm"|"09745619575, 09495260321, 09539458352"|"true"|"Engapuzha, Kedavur, Kerala 673586, India"|"11.468764400"|"75.968248200"
"43"|"Oruma Group."|"Perumpallil Building, Near Service Co-Op Bank, Anakkampoyil"|"Kozhikode"|"Kerala"|"673604"|"Mon 6.30 pm"|"09447338140"|"true"|"Perumpallil Building, Near Service Co-Op Bank, Anakkampoyil, Kozhikode, Kerala - 673604"|"11.436895500"|"75.058772000"
"44"|"Pavithram Group."|"Tagore College, Mukkam"|"Kozhikode"|"Kerala"|"673602"|"Mon 6.30 pm"|"07559884768, 09846641613"|"true"|"Manassery P.O, Kozhikode District, Mukkam, Kerala 673602, India"|"11.318463900"|"75.996435100"
"45"|"Prathyasa Group."|"St. Joseph's L.P.School, Erode"|"Kozhikode"|"Kerala"|"673001"|"Tue 6.30 pm"|"09744250448"|"true"|"Silk St, Mananchira, Kozhikode, Kerala 673032, India"|"11.252687100"|"75.773559800"
"46"|"Prakasam Group."|"St. George's Parish Hall, Maikkavu"|"Kozhikode"|"Kerala"|"673006"|"Fri 6.30 pm"|"09539662008, 08086802408"|"true"|"Manorama Jn,, Kozhikode, Kerala 673011, India"|"11.268415000"|"75.777038200"
"47"|"Pratheeksha Group."|"Fathima Matha Nursery School, Thekkumkutty"|"Kozhikode"|"Kerala"|"673602"|"Thu 6.00 pm"|"08086364515, 09539620357"|"true"|"Fathima Matha Nursery School, Thekkumkutty, Kozhikode, Kerala - 673602"|"11.258754300"|"75.780530000"
"48"|"Progress Group."|"Parish Hall, Kuppayakode"|"Kozhikode"|"Kerala"|"673580"|"Thu 6.30 pm"|"09562564373"|"true"|"NH 212, Puduppadi, Kerala 673586, India"|"11.481747100"|"75.987913200"
"49"|"Promise Group."|"Talent College, Engapuzha"|"Kozhikode"|"Kerala"|"673586"|"Fri 6.30 pm"|"08086157490"|"true"|"Talent College, Engapuzha, Kozhikode, Kerala - 673586"|"11.469432000"|"75.972449000"
"50"|"Relax Group."|"Big Book Study Meeting, AA Office, Venappara"|"Kozhikode"|"Kerala"|"673582"|"Thu / sat 6.30 pm"|"09946663602"|"true"|"Big Book Study Meeting, AA Office, Venappara, Kozhikode, Kerala - 673582"|"11.374217000"|"75.979705000"
"51"|"Santhwana Group."|"Santhwana De-Addiction Centre, Kattippara"|"Kozhikode"|"Kerala"|"673615"|"3rd Sun 2.00 pm"|"09745619575"|"true"|"Santhwana De-Addiction Centre, Kattippara, Kozhikode, Kerala - 673615"|"11.472134400"|"75.942043700"
"52"|"Ushas Group."|"St. Joseph's U.P.School, Pullurampara"|"Kozhikode"|"Kerala"|"673603"|"Thu 6.30 pm"|"09747259858, 09497303740"|"true"|"Pallippady - Ponnamkayam Rd, Pullurampara, Kerala 673603, India"|"11.398692800"|"76.034449400"
"53"|"Unarvu Group."|"Sunday School, Chembukadavu"|"Kozhikode"|"Kerala"|"673603"|"Fri 6.00 pm"|"09946011794, 09539301925"|"true"|"Sunday School, Chembukadavu, Kozhikode, Kerala - 673603"|"11.450359000"|"76.036290000"
"54"|"Sevanam Group."|"Prabhodhini Vayanasala Mannur, Kadalundi"|"Kozhikode"|"Kerala"|"673302"|"Tue 6.30 pm"|"08590240102"|"true"|"Prabhodhini Vayanasala Mannur, Kadalundi, Kozhikode, Kerala - 673302"|"11.136049200"|"75.827248200"
"55"|"Saswatham Group."|"Anganvadi Buuilding Karad, Ramanattukara"|"Kozhikode"|"Kerala"|"673633"|"Tue 6.30 pm"|"09447412541"|"true"|"Anganvadi Buuilding Karad, Ramanattukara, Kozhikode, Kerala - 673633"|"11.178528300"|"75.864986100"
"56"|"Udhayam Group."|"Saskarikanilayam, Melevaram Farook College,"|"Kozhikode"|"Kerala"|"673632"|"Tue 6.30 pm"|"09947537825"|"true"|"Saskarikanilayam, Melevaram Farook College,, Kozhikode, Kerala - 673632"|"11.258755400"|"75.780640000"
"57"|"Punniyam Group."|"Navadhara Paliyettive Centre, Kadalundy"|"Kozhikode"|"Kerala"|"673302"|"Wed 6.30 pm"|"09746750530"|"true"|"Navadhara Paliyettive Centre, Kadalundy, Kozhikode, Kerala - 673302"|"11.258753100"|"75.780410000"
"58"|"Sandesam Group."|"Anganvadi Building, Kannanchery"|"Kozhikode"|"Kerala"|"673003"|"Mon 6.30 pm"|"09388823120"|"true"|"National Highway 17, Mathottam, Kannanchery, Kozhikode, Kerala 673018, India"|"11.219854100"|"75.793729600"
"59"|"Simpile Group."|"Co-op College, Auditorium, Ramanattukara"|"Kozhikode"|"Kerala"|"673633"|"Wed 6.30 pm"|"08590240141"|"true"|"A17, Kozhikode - Palakkad Hwy, Palakkad, Ramanattukara, Kerala 673633, India"|"11.177937800"|"75.864263300"
"60"|"Soubhagya Group."|"Sivadas Smaraka Vayanasala, Kolathara"|"Kozhikode"|"Kerala"|"673655"|"Thu 6.30 pm"|"609388689470"|"true"|"Sivadas Smaraka Vayanasala, Kolathara, Kozhikode, Kerala - 673655"|"11.203771900"|"75.828701000"
"61"|"Santhi Group."|"A.U.P.B. School, Parmmel Ramanattukara,"|"Kozhikode"|"Kerala"|"673633"|"Mon 6.30 pm"|"09947046641"|"true"|"A.U.P.B. School, Parmmel Ramanattukara,, Kozhikode, Kerala - 673633"|"11.178528300"|"75.864986100"
"62"|"Snehanidhi Group."|"U.P.School Ambalangadi Nallur, Feroke,"|"Kozhikode"|"Kerala"|"673631"|"Mon 6.30 pm"|"09947140464"|"true"|"U.P.School Ambalangadi Nallur, Feroke,, Kozhikode, Kerala -  673631"|"11.176565200"|"75.831414600"
"63"|"Unarvu Group."|"R.C.C.M. College Auditorium, Ramanattukara"|"Kozhikode"|"Kerala"|"673633"|"Thu 6.30 pm"|"08590240106"|"true"|"A17, Kozhikode - Palakkad Hwy, Palakkad, Ramanattukara, Kerala 673633, India"|"11.177937800"|"75.864263300"
"64"|"Prabhatham Morning Group."|"Panchayath Market Building, Ramanattukara"|"Kozhikode"|"Kerala"|"673633"|"Sun 8.30 am"|"08547881090"|"true"|"Near Chemillil Masjid, Ramanattukara, Kozhikode, Kerala 673633, India"|"11.167917000"|"75.875418000"
"65"|"Anubhavam Group."|"Mathrusisu Kendram, Kunadayithode"|"Kozhikode"|"Kerala"|"-"|"Sun 6.00 pm"|"09562570434"|"true"|"Mathrusisu Kendram, Kunadayithode , Kozhikode, Kerala - -"|"11.258756300"|"75.780730000"
"66"|"Athani Group."|"G.H.S. Beypore, Bypore"|"Kozhikode"|"Kerala"|"673015"|"Sat 6.30 pm"|"08590240127"|"true"|"Beypore Cheruvannur Road, Kozhikode, Kerala 673015, India"|"11.183369800"|"75.806935400"
"67"|"Parinamam Group."|"Vennayur A.U.P.School, Ayikkarappadi"|"Kozhikode"|"Kerala"|"673637"|"Sat 6.30 pm"|"08547881090"|"true"|"Vennayur A.U.P.School, Ayikkarappadi, Kozhikode, Kerala - 673637"|"11.258756500"|"75.780750000"
"68"|"Asakiranam Group."|"Native School, Athanikkal"|"Kozhikode"|"Kerala"|"673614-"|"Sat 6.30 pm"|"09495847317"|"true"|"Malappuram, Kerala 673314, India"|"11.122033500"|"75.848370200"
"69"|"Subodham Group."|"G.H.S. Vattakinar, Meenchantha"|"Kozhikode"|"Kerala"|"673018"|"Thu 6.30 pm"|"08714391639"|"true"|"Vattakinar Kannencheri Rd, Meenchanda, Kozhikode, Kerala 673018, India"|"11.216694300"|"75.796631700"
"70"|"Hrudhayam Group."|"Ganapath UP School, Feroke"|"Kozhikode"|"Kerala"|"673631"|"Fri 6.30 pm"|"08590240141"|"true"|"Feroke, Kerala 673631, India"|"11.176154700"|"75.831000500"
"71"|"Chaithanya Group."|"Don Bosco, Mampetta"|"Kozhikode"|"Kerala"|"673672"|"Only 3rd Sun 2.00 pm"|"09544477220, 09447312311"|"true"|"Mampetta, Mukkam, Kerala 673602, India"|"11.326798300"|"75.978832200"
"72"|"Navaresmi Group."|"Jamayath Madressa, Punnackal"|"Kozhikode"|"Kerala"|"673603"|"Mon 6.30 pm"|"09645208619, 09946352502"|"true"|"Jamayath Madressa, Punnackal, Kozhikode, Kerala - 673603"|"11.377292400"|"75.043542500"
"73"|"Dhanya Group."|"SHUP School, Thiruvambady"|"Kozhikode"|"Kerala"|"673603"|"Sun 5.30 pm"|"08086300175, 09539182936"|"true"|"SHUP School, Thiruvambady, Kozhikode, Kerala - 673603"|"11.360833000"|"75.008889000"
"74"|"A.A. Meeting"|"Beach Hospital, Lecture Hall"|"Kozhikode"|"Kerala"|"673032"|"Sun 4.00 pm"|"09387519013"|"true"|"Red Cross Road, Vellayil, Kozhikode, Kerala 673032, India"|"11.256644800"|"75.770760500"
"75"|"A.A. Meeting"|"Kodinattu Mukku Samsarika Nilayanm, Audt. Olavanna"|"Kozhikode"|"Kerala"|"673019"|"Fir/Sun 6.30 pm"|""|"true"|"Kodinattu Mukku Samsarika Nilayanm, Audt. Olavanna, Kozhikode, Kerala - 673019"|"11.223530300"|"75.837417100"
"76"|"Abhayam Group"|"Palazhi Gramaposhini Wayan Shala, Near Pavopoyil Govt. School"|"Kozhikode"|"Kerala"|"673001"|"Mon 6.30 pm"|"09349703772"|"true"|"Palazhi Gramaposhini Wayan Shala, Near Pavopoyil Govt. School, Kozhikode, Kerala - 673001"|"11.258753300"|"75.780430000"
"77"|"Aiswaraya Group"|"At Akshaya Counseling Centre, Pulakkadavu Road, P.O. Vellimadukunnu"|"Kozhikode"|"Kerala"|"673012"|"Fri 7.00 pm"|"0495-2722539"|"true"|"At Akshaya Counseling Centre, Pulakkadavu Road, P.O. Vellimadukunnu, Kozhikode, Kerala - 673012"|"11.292067000"|"75.825796000"
"78"|"Aiswarya Group"|"Eravannoor Aup School, Narikuni"|"Kozhikode"|"Kerala"|"673585"|"Sun 6.30 pm"|"0495-2519455, 09496915499"|"true"|"Eravannur Masjid Rd, Pullaloor, Kerala 673585, India"|"11.357801000"|"75.844757300"
"79"|"Anugraha Group"|"Baby Memorial Hospital, Indira Gandhi Road"|"Kozhikode"|"Kerala"|"673 004"|"1st Sun 3.00 pm"|"09744460989"|"true"|"Indira Gandhi Road, Arayidathupalam, Kozhikode, Kerala 673004, India"|"11.259668800"|"75.792196300"
"80"|"Athany Group"|"Vidhyavarhini Nursery School, Beypore"|"Kozhikode"|"Kerala"|"673015"|"Sat 6.30 pm"|"0495-2416393"|"true"|"Beypore Cheruvannur Road, Kozhikode, Kerala 673015, India"|"11.183369800"|"75.806935400"
"81"|"City Group"|"St. Joseph Church, Mini Auditorium, Near Christian College, Kannur Road"|"Kozhikode"|"Kerala"|"673005"|"Fri 7.00 pm"|"09846069760"|"true"|"St. Joseph Church, Mini Auditorium, Near Christian College, Kannur Road, Kozhikode, Kerala - 673005"|"11.265792700"|"75.776864700"
"82"|"Freedom Group"|"Govt. G.U.P. School, Kandamkulam Cross Road, Opp. Jaya Auditorium Tali"|"Kozhikode"|"Kerala"|"673002"|"Sat 7.00 pm"|"09895565818"|"true"|"18/200, Kandamkulam Cross Rd, Markazudaawa, Palayam, Kozhikode, Kerala 673002, India"|"11.247247000"|"75.786323900"
"83"|"Grama Jeevan Group"|"Mannamkauu Naduuvanoor"|"Kozhikode"|"Kerala"|"673614"|"Wed 6.30 pm"|""|"true"|"Mannamkauu Naduuvanoor, Kozhikode, Kerala - 673614"|"11.258753100"|"75.780410000"
"84"|"Gramadeepam Group"|"Sri Vasudeva Ashram School, Naduvathur Koyilandi"|"Kozhikode"|"Kerala"|"673330"|"Tue 7.30 pm"|""|"true"|"Sri Vasudeva Ashram School, Naduvathur Koyilandi, Kozhikode, Kerala - 673330"|"11.606995000"|"75.582614400"
"85"|"Kozhikode East Zone I.G."|"Olavanna P.O."|"Kozhikode"|"Kerala"|"673019"|"2nd Sun 10.30 am"|"09539354634"|"true"|"Mavoor Rd, Kodinattumukku, Kozhikode, Kerala 673019, India"|"11.218063400"|"75.831889700"
"86"|"Media Meeting"|"Govt. Medical College Hospital, Word No. 45"|"Kozhikode"|"Kerala"|"673004"|"Mon 3.00 pm"|"0495-2519455"|"true"|"Government Medical College Campus, Kozhikode, Kerala 673008, India"|"11.272433100"|"75.837218900"
"87"|"Mukthi Group"|"Nhana Koumudhi Vayanashala, Near Homeo College, Karaparamba"|"Kozhikode"|"Kerala"|"673010"|"Mon 6.30 pm"|"09947535136"|"true"|"Nhana Koumudhi Vayanashala, Near Homeo College, Karaparamba, Kozhikode, Kerala - 673010"|"11.258754400"|"75.780540000"
"88"|"Navajeevan Group"|"Kammath line"|"Kozhikode"|"Kerala"|"673001"|"Tue 6.30 pm"|""|"true"|"Kammathi Ln, Palayam, Kozhikode, Kerala 673001, India"|"11.247505300"|"75.781821200"
"89"|"Navjeevan Group"|"St. Marries Church Sunday School, Auditorium Erapanthodu"|"Kozhikode"|"Kerala"|"673001"|"Mon 6.00 pm"|""|"true"|"St. Marries Church Sunday School, Auditorium Erapanthodu, Kozhikode, Kerala - 673001"|"11.258573100"|"75.780410000"
"90"|"Navodaya Group"|"Oxford College Balusserry"|"Kozhikode"|"Kerala"|"673623"|"-"|"09446890035"|"true"|"Oxford College Balusserry, Kozhikode, Kerala - 673623"|"11.606990000"|"75.582614400"
"91"|"Piravi Group"|"Lecture Hall Beach Hospital"|"Kozhikode"|"Kerala"|"-"|"3rd Sun 3.30 pm (Open Meeting)"|"09349121825, 09745303483"|"true"|"Lecture Hall Beach Hospital, Kozhikode, Kerala - -"|"11.258754800"|"75.780580000"
"92"|"Prasanthi Group"|"A.L.P. School, Near Bus Stop, Kunnamangalam"|"Kozhikode"|"Kerala"|"673571"|"1st Sun 4.00 pm"|"09387751159, 09745140459"|"true"|"A.L.P. School, Near Bus Stop, Kunnamangalam, Kozhikode, Kerala -  673571"|"11.258754900"|"75.780590000"
"93"|"Pulari Group"|"Sureksha Hospital Auditorium, Near Civil Station"|"Kozhikode"|"Kerala"|"673020"|"Wed 6.30 pm"|"09349195567, 09745700000"|"true"|"State Highway 29, Eranhippalam, Kozhikode, Kerala 673020, India"|"11.284018000"|"75.791752000"
"94"|"Sahrudaya Group"|"P.V.K.M. Kalasamithy, Koyilandy"|"Kozhikode"|"Kerala"|"673303"|"Thu 6.30 pm"|""|"true"|"P.V.K.M. Kalasamithy, Koyilandy, Kozhikode, Kerala - 673303"|"10.430419000"|"76.219299000"
"95"|"Soumya Group"|"Santhi Chikista Kendram, Velliparamba Varambu Stop"|"Kozhikode"|"Kerala"|"673008"|"2nd Sun 2.30 pm (Open Meeting)"|"09947382856, 09349432922"|"true"|"Santhi Chikista Kendram, Velliparamba Varambu Stop, Kozhikode, Kerala - 673008"|"11.270934100"|"75.846731800"
"96"|"Subodham Group"|"Saptakala Kayikavedi Pallipuram, Olavanna"|"Kozhikode"|"Kerala"|"673025"|"Fri/Mon 6.30 pm"|""|"true"|"Saptakala Kayikavedi Pallipuram, Olavanna, Kozhikode, Kerala - 673025"|"11.258755300"|"75.780410000"
"97"|"Subodhan Group"|"Meenchanda Govt. High School, Vattakinar Meenchanda"|"Kozhikode"|"Kerala"|"673018"|"Thu 7.00 pm"|"09388823120"|"true"|"Beypore Rd, Government Arts And Science College PO, Vattakinar, District Kozhikode, Meenchanda, Kerala 673018, India"|"11.214776000"|"75.796999200"
"98"|"Sunday Group"|"Soujanya Wayana Shala, Azchavattom"|"Kozhikode"|"Kerala"|"673007"|"Sun 8.00 am (Morng Meeting)"|"09387447399"|"true"|"Soujanya Wayana Shala, Azchavattom , Kozhikode, Kerala - 673007"|"11.258753100"|"75.780410000"
"99"|"Sunday Group"|"Vidya Tuition Center, Kannadipoyil Balussery"|"Kozhikode"|"Kerala"|"673612"|"Sun 6.30 pm"|"0496-2644848"|"true"|"Avitanallur, Kerala 673612, India"|"11.477380000"|"75.845199100"
"100"|"Thondilakkadavu Group"|"Thondilakkadavu Library, Olavanna"|"Kozhikode"|"Kerala"|"673019"|"Mon 6.30 pm"|""|"true"|"Thondilakkadavu Library, Olavanna, Kozhikode, Kerala - 673019"|"11.223530300"|"75.837417100"
"101"|"Udayam Group"|"Saritha Cultural Form Ferok College Jn."|"Kozhikode"|"Kerala"|"-"|"Tue 6.30 pm"|""|"true"|"Saritha Cultural Form Ferok College Jn., Kozhikode, Kerala - -"|"11.258753100"|"75.780410000"
"102"|"Ulhas Group"|"St. Joseph School, Pullorampara"|"Kozhikode"|"Kerala"|"-"|"-"|""|"true"|"Red Cross Rd, Moonalungal, Vellayil, Kozhikode, Kerala 673032, India"|"11.256510000"|"75.774617100"
"103"|"Velicham Group"|"Shree Ramakrishna Mission School, Meenchanda"|"Kozhikode"|"Kerala"|"673018"|"Sun 6.00 pm"|"09947820747"|"true"|"R.K Mission School, Kannancheri, Kannanchery, Kozhikode, Kerala 673001, India"|"11.219135900"|"75.794648300"
"104"|"Vivekam Group"|"Near 6th Mile Ration Shop, Velliparamba."|"Kozhikode"|"Kerala"|"673008"|"Thu 7.00 pm"|"09349068787"|"true"|"Velliparamba, Kozhikode, Kerala 673008, India"|"11.270934100"|"75.846132800"
"105"|"Prashanti Group"|"Opp. Post Office"|"Kunnamagalam"|"Kerala"|"673571"|"Sun 6.00 pm"|""|"true"|"Kunnamangalam Post Office, MLA Rd, Kunnamangalam, Kerala 673571, India"|"11.306013300"|"75.879129300"
"106"|"Mythree Group"|"Udhaya College, Peringalam"|"Kunnamangalam"|"Kerala"|"673571"|"Mon 7.00 pm"|"09387751149"|"true"|"Udhaya College, Peringalam, Kunnamangalam, Kerala -  673571"|"11.304930000"|"75.877052000"
"107"|"Daya Group."|"GLP School, Vayaparapadi, Manjeri"|"Malappuram Dist."|"Kerala"|"676517"|"Sun 4.30 pm"|"08907666666"|"true"|"GLP School, Vayaparapadi, Manjeri, Malappuram Dist., Kerala - 676517"|"11.120298400"|"76.119967700"
"108"|"Karuna Group."|"St. Jammas School, Kunnummal,"|"Malappuram Dist."|"Kerala"|"676541"|"Tue 6.30 pm"|"09846088379"|"true"|"St. Jammas School, Kunnummal, , Malappuram Dist., Kerala - 676541"|"11.050639000"|"76.068391900"
"109"|"Pradeeksha Group."|"G.L.P.School, Palazhi Near J.T.S., Manjeri"|"Malappuram Dist."|"Kerala"|"676121"|"Tue 6.30 pm"|"09142340269"|"true"|"G.L.P.School, Palazhi Near J.T.S., Manjeri, Malappuram Dist., Kerala - 676121"|"11.050640000"|"76.068392000"
"110"|"Punarjani Group."|"Wandoor Aiswarya Hotel Buildings, Nilamboor Road, Wandoor"|"Malappuram Dist."|"Kerala"|"679328"|"Sun 4.00 pm"|"09447537665"|"true"|"SH73, Wandoor, Kerala 679328, India"|"11.201724000"|"76.234072000"
"111"|"Nanma Grouup."|"Govt. School, Manjeri"|"Malappuram Dist."|"Kerala"|"676517"|"Sun 4.30 pm"|"09539070628"|"true"|"Vellarangal Manjeri, Kerala 676517 India, Manjeri, Kerala 676517, India"|"11.111092100"|"76.120414600"
"112"|"Nandhi Group."|"Kizhakkethala Madrassa, Manjeri"|"Malappuram Dist."|"Kerala"|"676121"|"Sun 6.30 pm"|"09946564049"|"true"|"Maylappuram Civil Station Rd, Kannathupara, Down Hill, Malappuram, Kerala 676505, India"|"11.039802000"|"76.073178000"
"113"|"Aswas Group."|"Marthoma School, Ponnani"|"Malappuram Dist."|"Kerala"|"679586"|"Sun 5.00 pm"|"09249222559"|"true"|"Marthoma School, Ponnani, Malappuram Dist., Kerala - 679586"|"11.050645000"|"76.068392500"
"114"|"Soorya Thejas Group."|"Azhijilam, Ramanattukara"|"Malappuram Dist."|"Kerala"|"673632"|"Sun"|"09746115722"|"true"|"Azhinjilam, Ramanattukara, Kerala 673633, India"|"11.200061700"|"75.866467200"
